{
  "schema_version": 1,
  "mode": "rules_only",
  "header": "HIGH_CONCERN",
  "action_requested": {
    "text_en": "Send ₹20,000 to a personal-style UPI ID for IPO allotment, today; keep it secret.",
    "text_hi": "₹20,000 किसी के निजी UPI पर (IPO अलॉटमेंट के लिए) भेजें, आज ही; किसी को न बताएँ।",
    "amount": 20000,
    "deadline": true,
    "secrecy": true
  },
  "items": [
    {
      "id": "p1_ipo_upi",
      "card": "P1_IPO_UPI",
      "label": "CONTRADICTED",
      "forgeability": "hard",
      "title_hi": "IPO अलॉटमेंट के लिए किसी और को पैसे भेजने को कहा गया है",
      "title_en": "Asked to pay someone else for IPO allotment",
      "why_hi": "सामान्य IPO आवेदन में आप अपनी ही UPI ID से बोली लगाते हैं और आपके अपने खाते में पैसे रोके जाते हैं। अलॉटमेंट के लिए किसी तीसरे व्यक्ति को पैसे भेजना SEBI की बताई सामान्य प्रक्रिया से मेल नहीं खाता।",
      "why_en": "In a normal IPO application you bid from your own UPI ID and approve a mandate that blocks money in your own account. Paying a third party for allotment does not match the standard flow described by SEBI.",
      "source": {
        "name": "SEBI: applying for IPOs through UPI",
        "url": "https://www.sebi.gov.in",
        "date": "",
        "verified": false
      },
      "settle_en": "Apply only from your own broker or bank app, with your own UPI ID.",
      "settle_hi": "आवेदन सिर्फ़ अपने ब्रोकर या बैंक के ऐप से, अपनी ही UPI ID से करें।"
    },
    {
      "id": "p3_sebi_named_claims",
      "card": "P3_SEBI_NAMED_CLAIMS",
      "label": "CONTRADICTED",
      "forgeability": "hard",
      "title_hi": "ऑफ़र उन दावों जैसा है जिन्हें SEBI ने चेतावनी के संकेत बताया है",
      "title_en": "Offer matches claims SEBI has named as warning signs",
      "why_hi": "SEBI की एडवाइज़री में पक्का IPO अलॉटमेंट, इंस्टीट्यूशनल ट्रेडिंग खाता, सस्ता IPO/ब्लॉक डील और एंकर एक्सेस को चेतावनी के संकेत बताया गया है। यह संदेश उन संकेतों से मेल खाता है।",
      "why_en": "SEBI's advisory names guaranteed IPO allotment, institutional trading accounts, discounted IPO/block deals and anchor access as warning signs. This message matches those signals.",
      "source": {
        "name": "SEBI advisory, Aug 2025 (IPO allotment claims)",
        "url": "https://www.sebi.gov.in",
        "date": "",
        "verified": false
      },
      "settle_en": "No registered broker can guarantee allotment. Ask your own broker.",
      "settle_hi": "कोई रजिस्टर्ड ब्रोकर अलॉटमेंट की गारंटी नहीं दे सकता। अपने ब्रोकर से पूछें।"
    },
    {
      "id": "p2_payee_unverified",
      "card": "P2_BROKER_PAYMENT",
      "label": "COULDNT_VERIFY",
      "forgeability": "hard",
      "title_hi": "जिसे पैसे भेजने को कहा गया है, उसकी जाँच नहीं हो सकी",
      "title_en": "Payment destination could not be verified",
      "why_hi": "यह पेमेंट ID उस वैलिडेटेड पैटर्न जैसी नहीं है जो SEBI ने रजिस्टर्ड ब्रोकर और फंड के लिए बताया है। यह एक अतिरिक्त जाँच है, नियम नहीं, इसलिए सिर्फ़ इससे कुछ साबित नहीं होता।",
      "why_en": "This payment ID does not follow the validated-handle pattern SEBI describes for registered brokers and funds. Validated handles are an extra check, not a rule, so this alone proves nothing.",
      "source": {
        "name": "SEBI Check / validated UPI handles",
        "url": "https://www.sebi.gov.in",
        "date": "",
        "verified": false
      },
      "settle_en": "Search this ID on SEBI Check before paying. If it is not listed, do not pay.",
      "settle_hi": "पैसे भेजने से पहले इस ID को SEBI Check पर खोजें। सूची में न मिले तो पैसे न भेजें।"
    }
  ],
  "stage": {
    "index": 4,
    "name": "DEPOSIT_PUSH",
    "name_hi": "पैसे जमा करवाना",
    "name_en": "Deposit push",
    "because_en": "This looks like the \"deposit push\" stage because it asks you to send money.",
    "because_hi": "यह \"पैसे जमा करवाना\" वाले चरण जैसा लगता है क्योंकि पैसे भेजने को कहा गया है।"
  },
  "next_steps": [
    "stop_payment",
    "verify_payee_sebi_check",
    "ask_trusted_person"
  ],
  "payee": {
    "value": "rajeshipo.8800112233@okaxis",
    "type": "personal_style",
    "kind": "upi"
  },
  "situation": "PREVENTION",
  "privacy": {
    "on_device": [
      "redaction",
      "extraction",
      "rules"
    ],
    "sent": [],
    "to": "nobody (rules ran on this device)",
    "stored": "none"
  }
}
